J,"Seifi, A; Ehteram, M; Soroush, F",,,,"Seifi, Akram; Ehteram, Mohammad; Soroush, Fatemeh",,,Uncertainties of instantaneous influent flow predictions by intelligence models hybridized with multi-objective shark smell optimization algorithm,JOURNAL OF HYDROLOGY,,,,,,,,,,,,"Reliable prediction of influent time series has demonstrated importance in high-efficiency performance of wastewater treatment and reuse plants. Computational models are powerful tools that has been used for predicting influent time series. But, one of the major drawbacks of developed models is uncertainty analysis in instantaneous and multi-time step prediction of influent time series. For this purpose, a Multi-objective Shark Smell Optimization (MOSSO) algorithm is hybridized with multilayer perceptron (MLP) neural network, radial basis function (RBF) neural networks, and support vector machine (SVM) to optimize the models. These hybrid models of MLP-MOSSO, RBF-MOSSO, and SVM-MOSSO are used for predicting different prediction horizons of immediate, short-term, and long-term of influent time series. Accordingly, there are three objectives in MOSSO: (1) minimize mean absolute error (MAE) in different input vectors for best selection lag time influent time series, (2) achieve the optimal architecture of forecasting models by minimization root mean square error (RMSE) for model parameters, and (3) select accurate activate functions or kernel function of models for finding high accuracy of estimating models. The studied hybrid multi-objective models are modified using Taguchi method for determination of Pareto optimal solution sets. The proposed hybrid models and standalone models of MLP, RBF, and SVM are evaluated using Monte-Carlo uncertainty analysis, common evaluation criteria, and Taylor diagram in evaluation and reliability assessments. The results demonstrated that MLP-MOSSO model produce better results than RBF-MOSSO, SVM-MOSSO, and standalone models in all prediction horizons (S1I4: immediate-Q((t-5min)), Q((t-10min)); S2I16: short term Q((t-12hr)), Q((t-24hr)); S3I15: long term-Q((t-2day)), Q((t-4day))). The MLP-MOSSO model for immediate prediction horizon (Q((t-5min)), Q((t-10min))) with one hidden layer and five neurons in hidden layer, correlation coefficient (R-2) of 0.95, root mean square error (RMSE) of 1.1, Nash-Sutcliffe efficiency (NSE) of 0.91, RMSE-observations standard deviation ratio (RSR) of 0.14, and percent bias (PBIAS) of 12 for testing phase was chosen as the final and best model for predicting influent time series. Furthermore, it was found that all models have some uncertainties, but the uncertainties in the MLP-MOSSO model with immediate prediction horizon was less than other models for predicting influent time series. Finally based on the optimized results, an explicit equation is derived for the best MLP-MOSSO model to predict multi-step influent time series.",,,,,,,,,,,,,,,,,0022-1694,1879-2707,,,,AUG,2020,587,,,,,,,,124977,10.1016/j.jhydrol.2020.124977,,,,,,,WOS:000568819100087,,,,,,
J,"Blanco, M; Sanz, N; Valcarcel, J; Perez-Martin, RI; Sotelo, CG",,,,"Blanco, Maria; Sanz, Noelia; Valcarcel, Jesus; Perez-Martin, Ricardo I.; Sotelo, Carmen G.",,,Does Subunit Composition Influence the Intermolecular Crosslinking of Fish Collagen? A Study with Hake and Blue Shark Skin Collagens,POLYMERS,,,,,,,,,,,,"Acid-soluble collagens from European hake and Blue shark skin were isolated, characterized, and compared. As the structure of collagen determines its function, the final objective of this study was to investigate biochemical differences between both collagens to identify future potential applications. Chromatographic behavior revealed differences in collagen from both species. Increases of temperature and stirring time produced no effect on European hake collagen solubility in the mobile phase, resulting in the same chromatographic profiles. Conversely, the application of temperature and stirring-time increments showed a positive effect on Blue shark collagen solubility, resulting in different chromatographic profiles and observing higher molecular weight components when sample is incubated at 50 degrees C (15 min) after 48 h stirring. To test if the different chromatographic behavior exhibited by both collagens could be influenced by differences in subunit composition (alpha-chains), cation exchange chromatography was employed to separate collagen subunits. The electrophoretic patterns and gel permeation chromatography with light-scattering detection (GPC-LS) results of the obtained cation exchange peak fractions revealed differences regarding subunit composition between both species, influencing the crosslinking pattern. This is the first comparative study using GPC-LS to provide information of European hake and Blue shark collagen subunit composition.",,,,"Valcarcel, Jesus/F-2865-2017; Gonzalez Sotelo, Carmen/L-3696-2014; Perez-Martin, Ricardo/A-2399-2013","Valcarcel, Jesus/0000-0001-7336-4049; Sanz Pereira, Noelia/0000-0001-7591-4382; Gonzalez Sotelo, Carmen/0000-0002-0726-4370; Perez-Martin, Ricardo/0000-0002-4918-9399",,,,,,,,,,,,,2073-4360,,,,AUG,2020,12,8,,,,,,,1734,10.3390/polym12081734,,,,,,,WOS:000564893000001,32756429,,,,,
J,"Carter, AM; Soma, H",,,,"Carter, Anthony M.; Soma, Hiroaki",,,"Viviparity in the longest-living vertebrate, the Greenland shark (Somniosus microcephalus)",PLACENTA,,,,,,,,,,,,"Background: The Greenland shark is renowned for its great longevity, yet little is known about its reproduction. Methods: We supplemented the sparse information on this species by extrapolation from observations on other members of the sleeper shark family and the order Squaliformes. Results and conclusion: The Greenland shark is viviparous and a single observation suggests a litter size of about ten. The gestation period is unknown, but embryos reach a length of around 40 cm at birth. Nutrition is derived from the yolk sac with minimal histotrophy. The surface area of the uterus is increased by villi that presumably increase in length with advancing gestation. These villi are not likely to be secretory but play a key role in the oxygen supply to the embryo. We argue that the ability of the uterus to supply oxygen is a limiting factor for litter size, which is not likely to exceed the small number reported in this and other sleeper sharks.",,,,,,,,,,,,,,,,,0143-4004,1532-3102,,,,AUG,2020,97,,,,,,26,28,,10.1016/j.placenta.2020.05.014,,,,,,,WOS:000559965000004,32792058,,,,,
J,"Erhardt, T; Weder, R",,,,"Erhardt, Tobias; Weder, Rolf",,,Shark hunting: On the vulnerability of resources with heterogeneous species,RESOURCE AND ENERGY ECONOMICS,,,,,,,,,,,,"This paper examines the unprecedented decimation of sharks. In accordance with the biological characteristics and the economic environment of sharks, we extend the Brander-Taylor model of renewable resources and trade to a resource with a continuum of species which are heterogeneous with respect to their growth rate. The model implies that heterogeneity increases the vulnerability of a resource as relatively abundant species make harvesting economically viable even though slow-growing species are driven to extinction. The empirical analysis assesses the fate of sharks in the light of the model and finds that the likelihood of extinction is, indeed, significantly greater for shark species which exhibit low intrinsic growth. (C) 2020 Elsevier B.V. All rights reserved.",,,,,,,,,,,,,,,,,0928-7655,1873-0221,,,,AUG,2020,61,,,,,,,,101181,10.1016/j.reseneeco.2020.101181,,,,,,,WOS:000558497200014,,,,,,
J,"Juliusson, AD",,,,"Juliusson, Arni Daniel",,,Agricultural growth in a cold climate: the case of Iceland in 1800-1850,SCANDINAVIAN ECONOMIC HISTORY REVIEW,,,,,,,,,,,,"During the first half of the nineteenth-century Iceland experienced a steady increase in exports. New products were sought after for export by Danish merchants and the peasant farming community responded by increasing the production of the relevant products. The whole period from 1800 to 1850 saw a continuing increase in the exports of sheep products and shark liver oil, which had a common origin in peasant farming production. This period contrasts with the eighteenth century when there was no corresponding growth in exports. The level of exports in the eighteenth century remained overall much the same except during periods of dearth, when it fell. Traditionally the beginning of the modernisation of Icelandic society is dated to around 1880-1910. However, it could be argued that increasing exports of sheep products and shark liver oil after 1800 saw a clear break with the eighteenth-century pattern and that the period should be taken into consideration as being the origin period of economic modernisation in Iceland. This article discusses questions the exclusion not only of the role of peasant farming in the modernisation narrative of Iceland, but also of the Copenhagen merchant houses that organised the goods export from Iceland after 1800.",,,,,"Juliusson, Arni Daniel/0000-0003-4518-7801",,,,,,,,,,,,0358-5522,1750-2837,,,,,,,,,,,,,,,10.1080/03585522.2020.1788985,,AUG 2020,,,,,WOS:000558353100001,,,,,,
J,"Heiss, JW",,,,"Heiss, James W.",,,Whale burial and organic matter impacts on biogeochemical cycling in beach aquifers and leachate fluxes to the nearshore zone,JOURNAL OF CONTAMINANT HYDROLOGY,,,,,,,,,,,,"Coastal managers are increasingly faced with the challenge of disposing of stranded whale carcasses on beaches. Direct burial in the beach is often used as a cost effective method of disposal. However, whale burial management plans are often met with public resistance owing to the perceived risk of shark attraction to burial leachate that may discharge from the seabed. A reactive transport model was combined with a numerical variable-density groundwater flow model to assess buried whale leachate plume formation, transport, influence on beach aquifer reactivity, and discharge to coastal surface water for a range of burial setback distances, depths, and whale sizes. A second set of simulations was performed to evaluate aquifer nitrate removal efficiencies for a range of buried wrack scenarios and to evaluate the role of organic carbon source on beach reactivity. A sensitivity analysis was performed for both sets of models across ten physical and reaction parameters. Simulations using the best estimate parameter set showed that whale burials can produce DOC and ammonium leachate plumes in the beach aquifer that are transported to and discharge near the low tide line in water depths of 0.4-2.4 m. DOC and ammonium concentrations in discharging whale leachate werel.6 and 26 times higher than typical surf zone concentrations, respectively. Of the factors tested, the burial distance inland from the high tide line was the most important factor affecting leachate fluxes to surface water. Burials placed farther inland led to smaller DOC fluxes to surface water, but increased ammonium fluxes. Burial depth also affected whale leachate to the subtidal zone, with deeper burials resulting in smaller fluxes of DOC. Leached DOC from whale decomposition and from buried wrack can fuel denitrification hotspots within beach sediments. The sensitivity analysis showed that nitrate removal supported by buried wrack and whale leachate fluxes are highly dependent on beach properties, hydrologic forcing, and reaction parameters. The wrack model results have implications for beach scraping and the whale burial models show that whale leachate can be delivered to the shallow subtidal zone via groundwater discharge pathways, with potential implications for shark attraction and whale burial management practices.",,,,,,,,,,,,,,,,,0169-7722,1873-6009,,,,AUG,2020,233,,,,,,,,103656,10.1016/j.jconhyd.2020.103656,,,,,,,WOS:000557880300003,32554099,,,,,
J,"Aicardi, S; Amaroli, A; Gallus, L; Di Blasi, D; Ghigliotti, L; Betti, F; Vacchi, M; Ferrando, S",,,,"Aicardi, Stefano; Amaroli, Andrea; Gallus, Lorenzo; Di Blasi, Davide; Ghigliotti, Laura; Betti, Federico; Vacchi, Marino; Ferrando, Sara",,,"Quantification of neurons in the olfactory bulb of the catsharks Scyliorhinus canicula (Linnaeus, 1758) and Galeus melastomus (Rafinesque, 1810)",ZOOLOGY,,,,,,,,,,,,"In vertebrates, the olfactory bulb (OB) is the zone of the brain devoted to receiving the olfactory stimuli. The size of the OB relative to the size of the brain has been positively correlated to a good olfactory capability but, recently, this correlation was questioned after new investigation techniques were developed. Among them, the isotropic fractionator allows to estimate the number of neurons and non-neurons in a given portion of nervous tissue. To date, this technique has been applied in a number of species; in particular the OB was separately analyzed in numerous mammals and in a single crocodile species. Thus, a quantitative description of the OB's cells is available for a small portion of vertebrates. Main aim of this work was to apply isotropic fractionator to investigate the olfactory capability of elasmobranch fishes, whose traditional concept of outstanding olfaction has recently been scaled down by anatomical and physiological studies. For this purpose, the OB of two elasmobranch species, Galeus melastomus and Scyliorhinus canicula, was studied leading to the determination of the number of neurons vs non-neurons in the OB of the specimens. In addition, the obtained cell quantification was related to the olfactory epithelium surface area to obtain a new parameter that encapsulates both information on the peripheral olfactory organ and the OB. The analyzed species resulted in an overall similar quantitative organization of the peripheral olfactory system; slight differences were detected possibly reflecting different environment preference and feeding strategy. Moreover, the non-neurons/neurons ratio of these species, compared to those available in the literature, seems to place elasmobranch fishes among the vertebrate species in which olfaction plays an important role.",,,,,"Amaroli, Andrea/0000-0002-0494-7942",,,,,,,,,,,,0944-2006,,,,,AUG,2020,141,,,,,,,,125796,10.1016/j.zool.2020.125796,,,,,,,WOS:000557218500005,32464514,,,,,
J,"Elliott, SAM; Bearup, D; Carpentier, A; Larivain, A; Trancart, T; Feunteun, E",,,,"Elliott, Sophie A. M.; Bearup, Daniel; Carpentier, Alexandre; Larivain, Angela; Trancart, Thomas; Feunteun, Eric",,,Evaluating the effectiveness of management measures on skates in a changing world,BIOLOGICAL CONSERVATION,,,,,,,,,,,,"Global declines in elasmobranchs have been observed. Conservation measures such as area closures and fisheries prohibitions have been put in place to support the recovery of vulnerable species. However, the effectiveness of such measures is rarely evaluated in the context of other factors that may affect population abundance. This study investigates the effectiveness of management measures using 1) General additive mixed model derivative changes, taking into account environmental factors that may affect population stochasticity and 2) an age-structured density dependent population dynamic model. The Raja undulata (undulate ray) 2009 targeted fisheries prohibition was used as a case study. Potential beneficial responses on sympatric species Raja clavata (thornback ray) were modelled. A significant increase in abundance was observed in both IUCN red list species during the ban. Surface seawater temperature had a marginal effect on the abundance of both species. The prohibition was in place for an insufficient length of time for long lasting effects to be detected on skate length. The population dynamic model indicated that the increase in abundance was only possible when combining the fisheries ban with increased juvenile discard survival. Our results indicate that species conservation measures may not only have positive effects on the species in question, but also on species with a niche overlap. Nonetheless, due to ongoing fishing for other species, the full potential of fisheries prohibitions may not be realised. For real benefits to be assessed, evaluation of bans should take place once a steady state is observed.",,,,,,,,,,,,,,,,,0006-3207,1873-2917,,,,AUG,2020,248,,,,,,,,108684,10.1016/j.biocon.2020.108684,,,,,,,WOS:000556843900040,,,,,,
J,"Feher, LC; Osland, MJ; Anderson, GH; Vervaeke, WC; Krauss, KW; Whelan, KRT; Balentine, KM; Tiling-Range, G; Smith, TJ; Cahoon, DR",,,,"Feher, Laura C.; Osland, Michael J.; Anderson, Gordon H.; Vervaeke, William C.; Krauss, Ken W.; Whelan, Kevin R. T.; Balentine, Karen M.; Tiling-Range, Ginger; Smith, Thomas J., III; Cahoon, Donald R.",,,The Long-Term Effects of Hurricanes Wilma and Irma on Soil Elevation Change in Everglades Mangrove Forests,ECOSYSTEMS,,,,,,,,,,,,"Mangrove forests in the Florida Everglades (USA) are frequently affected by hurricanes that produce high-velocity winds, storm surge, and extreme rainfall, but also provide sediment subsidies that help mangroves adjust to sea-level rise. The long-term influence of hurricane sediment inputs on soil elevation dynamics in mangrove forests is not well understood. Here, we assessed the effects of sediment deposition during Hurricanes Wilma (2005) and Irma (2017) on soil elevation change at two mangrove forests located along the Shark and Lostmans Rivers in Everglades National Park. We used surface elevation change data from a 16-year period (2002-2018), measured with the surface elevation table-marker horizon (SET-MH) approach. At the Shark River mangrove forest, we used marker horizons and a combination of deep, shallow, and original SETs to quantify the contributions of four soil zones to net soil elevation change. Rates of elevation change were greatly influenced by storm sediments. Abrupt increases in elevation due to sediment inputs and subsurface expansion during Hurricane Wilma were followed by: (1) an initial post-hurricane period of elevation loss due to erosion of hurricane sediments and subsurface contraction; (2) a secondary period of elevation gain due primarily to accretion; and (3) an abrupt elevation gain due to new sediment inputs during Hurricane Irma. Our findings suggest that elevation change in hurricane-affected mangrove forests can be cyclical or include disjunct phases, which is critical information for advancing the understanding of wetland responses to accelerated sea-level rise given the expectation of increasing storm intensity due to climate change.",,,,,,,,,,,,,,,,,1432-9840,1435-0629,,,,AUG,2020,23,5,,,,,917,931,,10.1007/s10021-019-00446-x,,,,,,,WOS:000556248000001,,,,,,
J,"Cappetta, H; Morrison, K; Adnet, S",,,,"Cappetta, H.; Morrison, K.; Adnet, S.",,,"A shark fauna from the Campanian of Hornby Island, British Columbia, Canada: an insight in the diversity of Cretaceous deepwater assemblages (Dec, 10.1080/08912963.2019.1681421, 2019)",HISTORICAL BIOLOGY,,,,,,,,,,,,,,,,,,,,,,,,,,,,,0891-2963,1029-2381,,,,,,,,,,,,,,,10.1080/08912963.2020.1794402,,AUG 2020,,,,,WOS:000555242800001,,,,,,
J,"Limpisophon, K; Shibata, J; Yasuda, Y; Tanaka, M; Osako, K",,,,"Limpisophon, Kanokrat; Shibata, Junichirou; Yasuda, Yuki; Tanaka, Munehiko; Osako, Kazufumi",,,Optimization of Hydrolysis Conditions for Production of Gelatin Hydrolysates from Shark Skin Byproduct and Evaluation of Their Antioxidant Activities,JOURNAL OF AQUATIC FOOD PRODUCT TECHNOLOGY,,,,,,,,,,,,"The effect of Alcalase hydrolysis conditions on antioxidant activities of shark skin gelatin hydrolysate (SSGH) byproduct was studied. Optimal hydrolysis condition for SSGH at 60 degrees C, pH 7.5, and 2.70 AU kg(-1)gelatin protein was used for varied hydrolysis times (10-90 min). The IC(50)against DPPH radicals of SSGH hydrolyzed for 90 min (SSGH-90) was 27.39 mg ml(-1), which is greater than ascorbic acid. SSGH-90 was predominantly composed of 15-20 kDa protein fragments that regulated increases in peroxide value and thiobarbituric acid reactive substances values and suppressed decrease in DHA of a fish oil-in-water emulsion during storage at 30 degrees C for 7 days.",,,,,"Limpisophon, Kanokrat/0000-0001-5435-4902",,,,,,,,,,,,1049-8850,1547-0636,,,,SEP 13,2020,29,8,,,,,736,749,,10.1080/10498850.2020.1799469,,AUG 2020,,,,,WOS:000555257400001,,,,,,
J,"Wang, XF; Huang, JW; Wang, P; Wang, RP; Wang, CL; Yu, D; Ke, CC; Huang, T; Song, Y; Bai, JH; Li, KP; Ren, LM; Miller, RD; Han, HT; Zhou, X; Zhao, YF",,,,"Wang, Xifeng; Huang, Jinwei; Wang, Peng; Wang, Renping; Wang, Chaolin; Yu, Di; Ke, Cuncun; Huang, Tian; Song, Yu; Bai, Jianhui; Li, Kongpan; Ren, Liming; Miller, Robert D.; Han, Haitang; Zhou, Xin; Zhao, Yaofeng",,,Analysis of the Chinese Alligator TCR alpha/delta Loci Reveals the Evolutionary Pattern of Atypical TCR delta/TCR mu in Tetrapods,JOURNAL OF IMMUNOLOGY,,,,,,,,,,,,"Atypical TCR delta found in sharks, amphibians, birds, and monotremes and TCR mu found in monotremes and marsupials are TCR chains that use Ig or BCR-like variable domains (VH delta/V mu) rather than conventional TCR V domains. These unconventional TCR are consistent with a scenario in which TCR and BCR, although having diverged from each other more than 400 million years ago, continue to exchange variable gene segments in generating diversity for Ag recognition. However, the process underlying this exchange and leading to the evolution of these atypical TCR receptor genes remains elusive. In this study, we identified two TCR alpha/delta gene loci in the Chinese alligator (Alligator sinensis). In total, there were 144 V, 154 J alpha, nine J delta, eight D delta, two C alpha, and five C delta gene segments in the TCR alpha/delta loci of the Chinese alligator, representing the most complicated TCR alpha/delta gene system in both genomic structure and gene content in any tetrapod examined so far. A pool of 32 VH delta genes divided into 18 subfamilies was found to be scattered over the two loci. Phylogenetic analyses revealed that these VH delta genes could be related to bird VH delta genes, VH delta/V mu genes in platypus or opossum, or alligator VH genes. Based on these findings, a model explaining the evolutionary pattern of atypical TCR delta/TCR mu genes in tetrapods is proposed. This study sheds new light on the evolution of TCR and BCR genes, two of the most essential components of adaptive immunity.",,,,,,,,,,,,,,,,,0022-1767,1550-6606,,,,AUG 1,2020,205,3,,,,,637,647,,10.4049/jimmunol.2000257,,,,,,,WOS:000551667400010,32591403,,,,,
J,"Pech, GAG; Fabila, G; Colin, RM; Flores, LFD; Trinidad, IDR; Salazar, FT",,,,"Pech, Genesis Ariadna Gutierrez; Fabila, GabrielaSanchez; Moreno Colin, Roberto; Del Moral Flores, Luis Fernando; Trinidad, Iris de los Angeles Rodriguez; Salazar, Francisco Torres",,,"Dental Diaphonization of Four Salaceos Species (Carcharhinus leucas, Galeocerdo Cuvier, Rhizoprionodon longurio and Sphyrna sp)",INTERNATIONAL JOURNAL OF MORPHOLOGY,,,,,,,,,,,,"The morphological study of the chondrichthyes teeth represents an important taxonomic characteristic used for the classification and identification of different species. The teeth of four different species of selacimorphs (Carcharhinus leucas, Galeocerdo cuvier, Rhizoprionodon longurio and Sphyrna sp.) were diaphonized in order to standardize a dental technique for their transparency. By standardizing the Okumura-Aprile technique applied for the dental diaphonization of humans, an optimal diaphonization was obtained in the four species treated with 7 % HCl where the pulp chamber was clearly observed. Therefore, we may conclude that the Okumura-Aprile technique is efficient in shark dental diaphonization.",,,,,,,,,,,,,,,,,0717-9502,0717-9367,,,,AUG,2020,38,4,,,,,970,974,,,,,,,,,WOS:000549940300026,,,,,,
J,"Barcia, LG; Argiro, J; Babcock, EA; Cai, Y; Shea, SKH; Chapman, DD",,,,"Barcia, Laura Garcia; Argiro, Juana; Babcock, Elizabeth A.; Cai, Yong; Shea, Stanley K. H.; Chapman, Demian D.",,,Mercury and arsenic in processed fins from nine of the most traded shark species in the Hong Kong and China dried seafood markets: The potential health risks of shark fin soup,MARINE POLLUTION BULLETIN,,,,,,,,,,,,"Shark fin is one of Asia's most valued dried seafood products, with over 80 shark species traded in Hong Kong [HK]. We analyzed processed shark fins from mainland China and HK markets (n = 267) for mercury, methyl-mercury, and arsenic, to inform consumers, policy makers and public health officials on the health risks of ingesting fins from nine of the most common shark species in the fin trade. Fins from all species frequently exceed Hg limits established by HK authorities. Most of the mercury found is in the form of methyl-mercury (69.0 +/- 33.5%). Five species surpass methyl-mercury PTWIs and blue shark fins can exceed inorganic arsenic BMDL0.5. Species-of-origin was a significant predictor of heavy metal concentrations, with higher mercury concentrations associated with coastal sharks and lower arsenic levels found with increasing shark trophic level. Species-specific labeling would help consumers avoid shark fin products that pose the highest health risk.",,,,"Cai, Yong/K-9868-2015","Cai, Yong/0000-0002-2811-4638; Garcia Barcia, Laura/0000-0002-0402-7564",,,,,,,,,,,,0025-326X,1879-3363,,,,AUG,2020,157,,,,,,,,111281,10.1016/j.marpolbul.2020.111281,,,,,,,WOS:000548531100039,32469749,,,,,
