J,"Lara, A; Galvan-Magana, F; Elorriaga-Verplancken, F; Marmolejo-Rodriguez, AJ; Gonzalez-Armas, R; Arreola-Mendoza, L; Sujitha, SB; Jonathan, MP",,,,"Lara, Ariagna; Galvan-Magana, Felipe; Elorriaga-Verplancken, Fernando; Judith Marmolejo-Rodriguez, Ana; Gonzalez-Armas, Rogelio; Arreola-Mendoza, Laura; Sujitha, S. B.; Jonathan, M. P.",,,"Bioaccumulation and trophic transfer of potentially toxic elements in the pelagic thresher shark Alopias pelagicus in Baja California Sur, Mexico",MARINE POLLUTION BULLETIN,,,,,,,,,,,,"Pelagic thresher shark (Alopias pelagicus) is a circumglobal species with high ecological and economic importance. Concentrations of mercury, selenium and cadmium in the muscle and liver tissues of A. pelagicus captured from Baja California Sur, Mexico were determined for assessing the potential human hazard. Results revealed that the average concentrations of Hg (0.76 mg kg(-1)) and Cd (0.18 mg kg(-1)) in muscle tissues were below the maximum permissible limits for human consumption. Se in the muscles were relatively low (mean: 0.30 mg kg(-1 -1)) resulting in a molar excess of Hg over Se. Average levels of hepatic Cd were extremely higher than the maximum limit for consumption. Organotropism of Hg was muscle > liver, whereas Se and Cd presented an order of liver > muscle. Biomagnification Factor (BMF) emphasized the trophic transfer of elements. Selenium Health Benefit value was negative (-3.76) posing potential health risks demanding regular monitoring for health risks.",,,,"MP, Jonathan/I-5764-2018","MP, Jonathan/0000-0001-9040-4911",,,,,,,,,,,,0025-326X,1879-3363,,,,JUL,2020,156,,,,,,,,111192,10.1016/j.marpolbul.2020.111192,,,,,,,WOS:000539160000010,32365003,,,,,
J,"Siomava, N; Shkil, F; Diogo, R",,,,"Siomava, Natalia; Shkil, Fedor; Diogo, Rui",,,"Comparative anatomy of the fin muscles of non-sarcopterygian fishes, with notes on homology and evolution",ANNALS OF ANATOMY-ANATOMISCHER ANZEIGER,,,,,,,,,,,,"Limited gross anatomical information about the muscles of fins, in particular those of the median fins, creates substantial gaps in the comparative anatomy, homologies, and evolution of these muscles across fishes. The scarcity of data also makes it difficult to interpret results obtained in developmental studies done in model organisms, such as zebrafish. To overcome these gaps, we provide descriptions of the configuration of all appendicular muscles of Amia, median fins of Polypterus, and the dorsal and anal fins of Lepisosteus and Chondrostei. The musculature of other species, including sharks and sturgeons, is also revised. We describe muscles that were previously overlooked, report sexual dimorphism in the muscles of the anal fin of Polypterus, and reveal muscle variations within Polypterus males. Species dissected for the present study thus represent all major non-sarcopterygian extant clades of gnathostomes, i.e. Chondrichthyes, Polypteriformes, Chondrostei, Lepisosteiformes, Amiiformes and Teleostei. Moreover, we compare our observations with the relatively few works that have provided information about muscles of at least some fins of these taxa in order to provide a broad discussion on - and detailed schemes showing - the major evolutionary patterns within the appendicular musculature of these fishes. Such discussion provides an opportunity for a more comprehensive understanding of appendicular evolution and fish evolution in particular and of gnathostome and morphological evolution in general. (C) 2020 Elsevier GmbH. All rights reserved.",,,,,,,,,,,,,,,,,0940-9602,1618-0402,,,,JUL,2020,230,,,,,,,,UNSP 151507,10.1016/j.aanat.2020.151507,,,,,,,WOS:000539110800002,32173564,,,,,
J,"Mohamadi, S; Ehteram, M; El-Shafie, A",,,,"Mohamadi, S.; Ehteram, M.; El-Shafie, A.",,,Accuracy enhancement for monthly evaporation predicting model utilizing evolutionary machine learning methods,INTERNATIONAL JOURNAL OF ENVIRONMENTAL SCIENCE AND TECHNOLOGY,,,,,,,,,,,,"Evaporation is an important parameter for water resource management. In this article, two case studies with different climates were considered in the prediction of monthly evaporation. The optimization algorithms, namely shark algorithm (SA) and firefly algorithms (FFAs), were used to train the adaptive neuro-fuzzy interface system (ANFIS), multilayer perceptron (MLP) model and radial basis function (RBF) model for the prediction of monthly evaporation. The monthly weather data from two stations, Mianeh station and Yazd station, operated by the Iran Meteorological Service were used to examine the proposed models. In the quantitative analysis, the hybrid ANFIS-SA improved the MAE index over the ANFIS, RBF, MLP, RBF-SA, MLP-SA, RBF-FFA, MLP-FFA and ANFIS-SA up to 47% during training and to 51% during testing while examining Yazd station. It should be mentioned that the higher RSR and MAE were attained by the hybrid soft computing (ANN-FFA, RBF-FFA and ANFIS-FFA) models in two stations. The results proved that the developed ANFIS models that have been integrated with shark algorithms could be considered as a powerful tool for predicting evaporation.",,,,,,,,,,,,,,,,,1735-1472,1735-2630,,,,JUL,2020,17,7,,,,,3373,3396,,10.1007/s13762-019-02619-6,,,,,,,WOS:000539029900004,,,,,,
J,"Zhang, WJ; Qin, LY; Cai, XY; Juma, SN; Xu, R; Wei, L; Wu, YX; Cui, X; Chen, GQ; Liu, LL; Lv, ZB; Jiang, XF",,,,"Zhang, Wenjie; Qin, Lanyi; Cai, Xinyi; Juma, Salma Nassor; Xu, Rong; Wei, Ling; Wu, Yixin; Cui, Xuan; Chen, Guiqian; Liu, Lili; Lv, Zhengbing; Jiang, Xiaofeng",,,Sequence structure character of IgNAR Sec in whitespotted bamboo shark (Chiloscyllium plagiosum),FISH & SHELLFISH IMMUNOLOGY,,,,,,,,,,,,"Whitespotted bamboo shark (Chiloscyllium plagiosum) is a demersal cartilaginous fish with an adaptive immune system founded upon immunoglobulins. In this manuscript, we characterize the IgNAR of the whitespotted bamboo shark. A newly discovered alternative splicing form of IgNAR Sec (IgNAR(sh)(ort) (Delta C2-C3) Sec) was identified, in which the C1 domain was spliced directly to the C4 domain, the process resulted in a molecule containing three constant domains. However, a single unpaired cysteine remains in the highly flexible hinge region, contributing in the formation of an interchain disulfide bond. Two types of C1 domain were found, and the one lacking a short a-helix showed lower proportion. This finding suggests that short alpha-helices might be important to the stability of IgNAR. High-throughput sequencing revealed that the percentage of V-NAR types significantly vary between the diverse species of sharks. The variable region of IgNAR (the V-NAR) with small size and stabilization is a potential candidate for immunotherapeutic agents. The structure and stability analysis in this manuscript may be useful in future biomedical applications.",,,,,"Jiang, Xiaofeng/0000-0002-6691-9816",,,,,,,,,,,,1050-4648,1095-9947,,,,JUL,2020,102,,,,,,140,144,,10.1016/j.fsi.2020.04.037,,,,,,,WOS:000537822700017,32311460,,,,,
J,"Strickland, BA; Massie, JA; Viadero, N; Santos, R; Gastrich, KR; Paz, V; O'Donnell, P; Kroetz, AM; Ho, DVT; Rehage, JS; Heithaus, MR",,,,"Strickland, Bradley A.; Massie, Jordan A.; Viadero, Natasha; Santos, Rolando; Gastrich, Kirk R.; Paz, Valeria; O'Donnell, Patrick; Kroetz, Andrea M.; Ho, David T.; Rehage, Jennifer S.; Heithaus, Michael R.",,,Movements of Juvenile Bull Sharks in Response to a Major Hurricane Within a Tropical Estuarine Nursery Area,ESTUARIES AND COASTS,,,,,,,,,,,,"Predicting the responses of animals to environmental changes is a fundamental goal of ecology and is necessary for conservation and management of species. While most studies focus on relatively gradual changes, extreme events may have lasting impacts on populations. Animals respond to major disturbances such as hurricanes by seeking shelter, migrating, or they may fail to respond appropriately. We assessed the effects of Hurricane Irma in 2017 on the behavior and survival of juvenile bull sharks (Carcharhinus leucas) within a nursery of the Florida coastal Everglades using long-term acoustic telemetry monitoring. Most of our tagged sharks (n = 14) attempted to leave the shallow waters of the Shark River Estuary before the hurricane strike, but individuals varied in the timing and success of their movements. Eight bull sharks left within hours or days before the hurricane, but three left more than a week in advance. Nine of 11 bull sharks (~ 82%) eventually returned to the array within weeks or months of the storm. Six of these returning individuals were detected in a different coastal array in nearshore waters ca. 80 km away from the mouth of the estuary during their absence. The remaining three bull sharks moved downstream relatively late (after the hurricane) and may have died. We used binomial generalized linear mixed models to estimate the probability of presence within the array as a function of several environmental variables. Departure from the array was predicted by declining barometric pressure, increasing rate of change in pressure, and potentially fluctuations in river stage. Juvenile bull sharks may weigh multiple environmental cues, perceived predation risk, their own physical size, and shifting prey resources when making decisions during and after hurricanes.",,,,,"Strickland, Bradley/0000-0001-6443-7672; Massie, Jordan/0000-0002-8255-7448; Heithaus, Michael/0000-0002-3219-1003; Kroetz, Andrea/0000-0002-9670-7478",,,,,,,,,,,,1559-2723,1559-2731,,,,JUL,2020,43,5,,,SI,,1144,1157,,10.1007/s12237-019-00600-7,,,,,,,WOS:000537511500017,,,,,,
J,"Begum, A; Sarker, S; Uzzaman, MS; Shamsuzzaman, MM; Islam, MM",,,,"Begum, Amany; Sarker, Subrata; Uzzaman, Md. Sifat; Shamsuzzaman, Md. Mostafa; Islam, Mohammad Mahmudul",,,"Marine megafauna in the northern Bay of Bengal, Bangladesh: Status, threats and conservation needs",OCEAN & COASTAL MANAGEMENT,,,,,,,,,,,,"This study investigated the status of charismatic marine megafauna in the northern Bay of Bengal. Specifically, we gathered information on fishers' perceptions of megafauna in the Bay of Bengal to determine whether fishers view megafauna species as beneficial or harmful and/or under threat. Fieldwork was conducted at five sites from the three coastal districts of Bangladesh. Data were collected through individual interviews (n = 150), focus group discussions (n = 13) and key informant interviews (n = 20). Small-scale fishers interact with marine megafauna as bycatch or intentional harvest, although a small portion of fishers keep the bycatch for sale and consumption or use as ingredients in traditional medicine. Most fishers release marine megafauna back into the water because they are not interested in the catch, they want to obey rules protecting these species or because of social taboos. Fishers have different views on the positive and negative roles of marine megafauna. The perceived positive roles are as indicators of productive fishing grounds, sources of food and livelihoods, and maintenance of ecosystem balance. The perceived negative roles are damage to fishing gear, personal injury, bad omens and predation on target fish. Irrespective of their perceived roles, megafauna groups are vulnerable to the use of fishing gear, pollution, overfishing, bycatch, direct killing, environmental changes and lack of awareness. The present study also summarises the relevant national and international legal obligations relating to the protection of megafauna. The findings reflect a lack of a coherent legal and institutional framework to facilitate conservation of marine megafauna. The results of this study contribute to a better understanding of megafauna status in the northern Bay of Bengal that, in effect, will help define future efforts to enhance marine megafauna conservation in the context of achieving the UN Sustainable Development Goal (SDG) 14 and blue growth.",,,,,"Shamsuzzaman, Dr. Md. Mostaf/0000-0002-5438-2257",,,,,,,,,,,,0964-5691,1873-524X,,,,JUL 1,2020,192,,,,,,,,105228,10.1016/j.ocecoaman.2020.105228,,,,,,,WOS:000534266700014,,,,,,
J,"Hoglin, BE; Miner, M; Dores, RM",,,,"Hoglin, Brianne E.; Miner, Marin; Dores, Robert M.",,,Pharmacological properties of whale shark (Rhincodon typus) melanocortin-2 receptor and melancortin-5 receptor: Interaction with MRAP1 and MRAP2,GENERAL AND COMPARATIVE ENDOCRINOLOGY,,,,,5th Biennial Meeting of the North-American-Society-for-Comparative-Endocrinology (NASCE) / 10th International Symposium on Amphibian and Reptilian Endocrinology and Neurobiology (ISAREN),"MAY 24-28, 2019","Univ Florida, Gainesville, FL",N Amer Soc Comparat Endocrinol,Univ Florida,,,"In the current study, the whale shark (ws; Rhincodon typus) melanocortin-2 receptor (MC2R) co-expressed with wsMRAP1 in Chinese Hamster Ovary (CHO) Cells could be stimulated in a dose dependent manner by ACTH(1-24) with an EC50 of 2.6 x 10(-10) M +/- 9.7 x 10(-11). When the receptor was expressed alone, stimulation was only observed at [10(-6) M]. A comparable increase in sensitivity to stimulation by srDes-Ac-alpha MSH was also observed when the receptor was co-expressed with wsMRAP1. In addition, co-expression with wsMRAP1 significantly increased the trafficking of wsMC2R to the plasma membrane of CHO cells. Surprisingly, co-expression with wsMRAP2 also increased sensitivity to stimulation by ACTH(1-24) and srDes-Ac-alpha MSH, and increased trafficking of the receptor to the plasma membrane. These observations are in sharp contrast to the response of MC2R orthologs of bony vertebrates which have an obligate requirement for co-expression with MRAP1 for both trafficking to the plasma membrane and activation, and while co-expression with MRAP2 increases trafficking, it has minimal effects on activation. In addition, when comparing the activation features of wsMC2R with those of the elephant shark MC2R and red stingray MC2R orthologs, both similarities and differences are observed. The spectrum of features for cartilaginous fish MC2R orthologs will be discussed. A second objective of this study was to determine whether wsMC5R has features in common with wsMC2R in terms of ligand selectivity and interaction with wsMRAP paralogs. While wsMC5R can be activated by either srACTH(1-24) or srDes-Ac-alpha MSH, and co-expression with wsMRAP1 enhances this activation, wsMRAP1 had no effect on the trafficking of wsMC5R. Co-expression with wsMRAP2 had no positive or negative effect on either ligand sensitivity or trafficking of wsMC5R.",,,,,,,,,,,,,,,,,0016-6480,1095-6840,,,,JUL 1,2020,293,,,,,,,,113463,10.1016/j.ygcen.2020.113463,,,,,,,WOS:000532158700001,32213301,,,,,
J,"Amalfitano, J; Giusberti, L; Fornaciari, E; Carnevale, G",,,,"Amalfitano, Jacopo; Giusberti, Luca; Fornaciari, Eliana; Carnevale, Giorgio",,,UPPER CENOMANIAN FISHES FROM THE BONARELLI LEVEL (OAE2) OF NORTHEASTERN ITALY,RIVISTA ITALIANA DI PALEONTOLOGIA E STRATIGRAFIA,,,,,,,,,,,,"The Bonarelli Level (BL) is a radiolarian-ichthyolithic, organic-rich marker bed that was deposited close to the Cenornanian/Turonia.n boundary (CTB) representing the sedimentary expression of the global Oceanic Anoxic Event 2 (OAE2). In northeastern Italy this horizon yielded fossil remains documenting a rather diverse ichthyofauna. The assemblage was studied by Sorbini in 1976 based on material from a single locality, Cinto Euganeo. Subsequently, other localities yielding fish remains have been discovered. Our revision also includes fish remains from three new fish-bearing localities, the Carcoselle Quarry, the Valdagno-Schio tunnel and Quem other than those from Bomba Quarry near Cinto Euganeo. At least 27 taxa were identified, including nine previously not reported from the Bonarelli Level, namely: Scpanorhynchus raphiodon, Cretalamna appendiculata, Archaeolamna kopingensis, 'Nursallid tethysensis, Belonostomus sp., Dixonanogmius dalmatius,'Protoenti stebbingi and the beryciform Hoplopteryx sp. The overall assemblage mostly consists of crossognathiforms, tselfatiiforms and aulopiforms. A comparison of the taxonomic diversity with coeval assemblages evidences a general similarity with nearby western Tethyan fish assemblages and especially with the Jbel Tselfat ichthyofauna, although some of the taxa are exclusively shared with the assemblages of the boreal realm (English Chalk, Westphalia and Saxony). However, additional information would be necessary to more properly define the main global ichthyogeographic patterns during the Cenomanian.",,,,"GIUSBERTI, LUCA/AAK-4640-2020","GIUSBERTI, LUCA/0000-0002-4401-5410",,,,,,,,,,,,0035-6883,2039-4942,,,,JUL,2020,126,2,,,,,261,314,,,,,,,,,WOS:000531606500002,,,,,,
J,"Hauser-Davis, RA; Pereira, CF; Pinto, F; Torres, JPM; Malm, O; Vianna, M",,,,"Hauser-Davis, Rachel Ann; Pereira, Camila Ferreira; Pinto, Fernando; Torres, Joao Paulo M.; Malm, Olaf; Vianna, Marcelo",,,"Mercury contamination in the recently described Brazilian white-tail dogfish Squalus albicaudus (Squalidae, Chondrichthyes)",CHEMOSPHERE,,,,,,,,,,,,"The recently described Squalus albicaudus is a mesopredator shark and, as such, exposed to mercury biomagnification processes. Therefore, this study aimed to assess total Hg (THg) concentrations in S. albicaudus, a deep-water species, sampled off Southeastern Brazil and discuss ecological, reproductive, human consumption and conservation implications. Thirty-two individuals were sampled off the coast of Rio de Janeiro, including 13 gravid females carrying 34 embryos. Muscle THg concentrations were higher in all sex classes compared to liver, gonads and brain. The last three, in turn, presented THg concentrations above toxic biota thresholds. Significant correlations were observed between muscle and brain and liver, indicating systemic Hg contamination and inter-organ transport and distribution. In addition, correlations observed between organs strongly support efficient Hg blood-brain barrier crossing and maternal transfer. Maternal THg transfer was observed, with embryo THg also above toxic thresholds for fish. THg levels in muscle and liver, as well as embryos, were higher compared to other Squalus species worldwide. Hg contamination off the coast of Rio de Janeiro is of significant concern and should be further assessed. Potential human consumption risks are noted, as muscle THg concentrations were above maximum permissible levels set by regulatory agencies. (C) 2020 Elsevier Ltd. All rights reserved.",,,,,,,,,,,,,,,,,0045-6535,1879-1298,,,,JUL,2020,250,,,,,,,,126228,10.1016/j.chemosphere.2020.126228,,,,,,,WOS:000530709300076,32114339,,,,,
J,"Feichtinger, I; Lukeneder, A; Guinot, G",,,,"Feichtinger, Iris; Lukeneder, Alexander; Guinot, Guillaume",,,A Lower Cretaceous chondrichthyan dermal denticle assemblage and its bearing on placoid scale diversity and histology,CRETACEOUS RESEARCH,,,,,,,,,,,,"Dermal denticles of Mesozoic chondrichthyans are rarely documented, which tremendously limits the knowledge of different morphotypes during this time and for the whole clade. Here we describe an extraordinarily diverse assemblage of dermal denticles from deposits of Austria, comprising 17 different morphotypes. Based on the functional types of the denticles and their morphological similarities with both extinct and extant representatives, we attempt an order-level taxonomic attribution of the morphotypes recovered. The herein recorded occurrences of Hexanchiformes, Squaliformes, Squatiniformes, Heterodontiformes, the family Protospinacidae (Squalomorphii incertae sedis), and probably Rajiformes or Chimaeriformes increase previous tooth-based taxic diversity estimates of Valanginian cartilaginous fishes from Austria from four to at least nine orders. Additionally, we discuss the absence of denticles of cladodontomorph chondrichthyans, whose teeth were previously reported from the same deposits. Etched sections and light microscope analysis were carried out using the most abundant morphotypes with the aim of exploring the histology of chondrichthyan dermal denticles. Our results confirm previous studies in reporting a single crystallite enameloid, but we also report for the first time the presence of bundled enameloid in dermal scales, a condition so far restricted to the tooth enameloid of some chondrichthyans. Additionally, a putative new dentine type is observed, leading to the introduction of the descriptive term 'nepedentine' for the internal, dense, and poorly supplied dentine core by vascular channels. (C) 2020 Elsevier Ltd. All rights reserved.",,,,,"Guinot, Guillaume/0000-0003-3363-6972",,,,,,,,,,,,0195-6671,1095-998X,,,,JUL,2020,111,,,,,,,,104444,10.1016/j.cretres.2020.104444,,,,,,,WOS:000527613900001,,,,,,
J,"Neraudeau, D; Vullo, R; Benefice, P; Breton, G; Depre, E; Gaspard, D; Girard, V; Le Couls, M; Moreau, JD; Nel, A; Perrichot, V; Solorzano-Kraemer, MM; Wappler, T",,,,"Neraudeau, Didier; Vullo, Romain; Benefice, Pierre; Breton, Gerard; Depre, Eric; Gaspard, Daniele; Girard, Vincent; Le Couls, Matthieu; Moreau, Jean-David; Nel, Andre; Perrichot, Vincent; Solorzano-Kraemer, Monica M.; Wappler, Torsten",,,"The paralic Albian-Cenomanian Puy-Puy Lagerstatte (Aquitaine Basin, France): An overview and new data",CRETACEOUS RESEARCH,,,,,,,,,,,,"The Puy-Puy quarry at Tonnay-Charente (Charente-Maritime, SW France) is a sand quarry exposing a 9-m-thick series of latest Albianeearliest Cenomanian (mid-Cretaceous) age. The uppermost Albian deposits consist of lignitic clay containing fossiliferous amber. The lowermost Cenomanian sand deposits alternate with clay intercalations containing plant remains. One of these clay levels, named P1, shows an outstanding accumulation of conifer and angiosperm macrofossils including delicate reproductive structures such as flowers. Plant remains are associated with invertebrates such as insects (Odonata, Dictyoptera, Diptera), crustaceans (Mecochirus sp.), putative brachiopods (aff. Lingula sp.), and worms. A few vertebrate remains such as shark egg capsules (Palaeoxyris sp.) and a feather are present in the fossil assemblage, as well as an enigmatic specimen tentatively interpreted as a cephalochordate or a petromyzontiform. Various ichnofossils occur in abundance, such as crustacean coprolites and burrows (Ophiomorpha isp.), insect coprolites (Microcarpolithes hexagonalis), and leaf herbivory, galls and mines. The sediments have been deposited in a coastal, calm and brackish area. (C) 2019 Elsevier Ltd. All rights reserved.",,,,"Wappler, Torsten/D-4287-2011","Wappler, Torsten/0000-0003-1592-0988; Solorzano Kraemer, Monica M./0000-0003-3065-119X",,,,,,,,,,,,0195-6671,1095-998X,,,,JUL,2020,111,,,,,,,,104124,10.1016/j.cretres.2019.03.022,,,,,,,WOS:000527613900014,,,,,,
J,"Owocki, K; Madzia, D",,,,"Owocki, Krzysztof; Madzia, Daniel",,,Predatory behaviour in mosasaurid squamates inferred from tooth microstructure and mineralogy,CRETACEOUS RESEARCH,,,,,,,,,,,,"Dental morphology, microstructure and chemistry provide unique insights into various aspects of the evolutionary history and ecology of extinct clades. However, most studies have focused exclusively on the morphological aspects of teeth, while there are significantly fewer detailed accounts of tooth microstructure and mineralogy. Here we provide a full description of the enamel and dentine microstructure of mosasaurid squamates based on an assessment of isolated teeth belonging to two distantly related mosasaurid taxa, i.e., a russellosaurinan and a mosasaurine, from the ?Coniaciane-Santonian and Maastrichtian of Belgium. The obtained data are further explored with regard to their value for inferences of mosasaurid predatory behaviour. SEM observations have shown that the Schmelzmuster consists of columnar enamel with an outer layer of parallel crystallites; transmitted light observations have further revealed the presence of mantle dentine cushioning between enamel and orthodentine, and electron microprobe analyses have demonstrated the unaltered enamel chemistry and heterogeneous diagenetic alteration of dentine. Columnar enamel allows minute movements without rupture under bending stress, and together with the presence of shock-absorbing mantle dentine and possibly elevated Fe contents in the enamel, which increase its hardness and enhance acid resistance, it is suggestive of a good ability of the teeth to withstand severe mechanical damage. Such properties of teeth indicate adaptation to shaking and tearing large and resisting prey. (C) 2020 The Authors. Published by Elsevier Ltd.",,,,"Owocki, Krzysztof/ABA-4558-2020; Madzia, Daniel/AAH-1299-2020","Owocki, Krzysztof/0000-0002-1270-3622; Madzia, Daniel/0000-0003-1228-3573",,,,,,,,,,,,0195-6671,1095-998X,,,,JUL,2020,111,,,,,,,,104430,10.1016/j.cretres.2020.104430,,,,,,,WOS:000527613900012,,,,,,
