J,"Amadori, M; Amalfitano, J; Giusberti, L; Fornaciari, E; Carnevale, G; Kriwet, J",,,,"Amadori, Manuel; Amalfitano, Jacopo; Giusberti, Luca; Fornaciari, Eliana; Carnevale, Giorgio; Kriwet, Jurgen",,,"A revision of the Upper Cretaceous shark Ptychodus mediterraneus Canavari, 1916 from northeastern Italy, with a reassessment of P. latissimus and P. polygyrus Agassiz, 1835 (Chondrichthyes; Elasmobranchii)",CRETACEOUS RESEARCH,,,,,,,,,,,,"Dental and skeletal remains of Ptychodus mediterraneus from the Upper Cretaceous Scaglia Rossa Formation of northeastern Italy are described and discussed herein, together with isolated teeth of P. latissimus and P. polygyrus from the English Chalk of Sussex, southern England. The redescription of the holotype of Ptychodus mediterraneus and lectotype fixations for P. latissimus and P. polygyrus allow the systematic reassessment of the three low-crowned Ptychodus species. In addition, these taxa are compared with other morphologically similar species, such as P. martini and P. marginalis. Micropalaeontological analyses suggest a Turonian age for the low-crowned P. mediterraneus. Based on articulated tooth sets of P. mediterraneus, the pavement-like dentitions of this durophagous taxon are reconstructed herein, revealing a marked dignathic heterodonty. Imbricated dentitions observed in articulated specimens of Ptychodus mediterraneus also suggest broad distributions of bite-induced load on tooth plates; the dental features of this low-crowned durophagous shark indicate a high specialization for grinding thick-shelled bivalves (e.g., inoceramids and rudists). Fragments of cranial mineralized cartilages (e.g., a 'V-shaped' jaw portion) of P. mediterraneus are consistent to those commonly occurring in fusiform sharks. Evidences of scavenging on Ptychodus recorded on cartilages and tooth-bioerosion are also reported herein. Moreover, a posterior-to-anterior tooth replacement is hypothesized for Ptychodus based on the abrasion patterns observed in articulated dental sets. New insights on the palaeoecology and palaeobiology of Ptychodus are also provided. (C) 2020 Elsevier Ltd. All rights reserved.",,,,"GIUSBERTI, LUCA/AAK-4640-2020","GIUSBERTI, LUCA/0000-0002-4401-5410",,,,,,,,,,,,0195-6671,1095-998X,,,,JUN,2020,110,,,,,,,,104386,10.1016/j.cretres.2020.104386,,,,,,,WOS:000527613000013,,,,,,
J,"Johri, S; Fellows, SR; Solanki, J; Busch, A; Livingston, I; Mora, MF; Tiwari, A; Cantu, VA; Goodman, A; Morris, MM; Doane, MP; Edwards, RA; Dinsdale, EA",,,,"Johri, Shaili; Fellows, Sam R.; Solanki, Jitesh; Busch, Anissa; Livingston, Isabella; Mora, Maria Fernanda; Tiwari, Anjani; Cantu, Vito Adrian; Goodman, Asha; Morris, Megan M.; Doane, Michael P.; Edwards, Robert A.; Dinsdale, Elizabeth A.",,,Mitochondrial genome to aid species delimitation and effective conservation of the Sharpnose Guitarfish (Glaucostegus granulatus),META GENE,,,,,,,,,,,,"We present the complete mitochondrial genome of the Sharpnose/Granulated Guitarfish Glaucostegus granulatus, obtained with whole genome shotgun sequencing of genomic DNA. The 16,547 bp long circular genome consisted of 13 protein-coding genes, 22 tRNA genes, 2 rRNA genes, and a non-coding control region. A few protein-coding genes ended with incomplete stop codons. Phylogenetic analysis provided strong support for the specimen to be identified as G. granulatus and improved resolution of phylogeny within the genus Glaucostegus such as placing G. thouin in a sister group with G. typus. This is the first complete mitogenome within the genus Glaucostegus and will be beneficial to future molecular taxonomic studies and species identification, population studies and conservation efforts involving G. granulatus.",,,,"Morris, Megan/AAK-2190-2020","Morris, Megan/0000-0002-7024-8234; Edwards, Robert/0000-0001-8383-8949; dinsdale, elizabeth/0000-0002-2177-203X; Johri, Shaili/0000-0001-7481-7548",,,,,,,,,,,,,2214-5400,,,,JUN,2020,24,,,,,,,,100648,10.1016/j.mgene.2020.100648,,,,,,,WOS:000525750700044,,,,,,
J,"Martinez-Candelas, IA; Perez-Jimenez, JC; Espinoza-Tenorio, A; McClenachan, L; Mendez-Loeza, I",,,,"Martinez-Candelas, I. A.; Perez-Jimenez, J. C.; Espinoza-Tenorio, A.; McClenachan, L.; Mendez-Loeza, I",,,Use of historical data to assess changes in the vulnerability of sharks,FISHERIES RESEARCH,,,,,,,,,,,,"Shark populations have declined worldwide. However, the lack of data for most species makes it difficult to use conventional population assessments to estimate their status. The productivity and susceptibility analysis (PSA) has been recommended for elasmobranchs as it is a data-poor assessment that uses the best available information of the species and their fisheries to determine their vulnerability. A historical characterisation was performed to define the most important periods for the shark fishery in Campeche, southern Gulf of Mexico, and a PSA was conducted to determine the vulnerability of the eleven most important commercial shark species in each three periods. The periods were defined as: local commercialisation (1940-1979), when all species had their lowest vulnerability values, and Carcharhinus leucas, Negraprion brevirostris, and Sphyrna mokarran were classified as highly vulnerable; developed industry (1980-1998) when there was an increase of the fishing pressure, and most small species changed from low to moderate vulnerability and the large coastal sharks scored their highest vulnerability values; and declining industry (1999-2018), when all species had lower vulnerability values than in the developed industry period. However, Carcharhinus brevipinna, Ginglymostoma cirratum, N. brevisrostris, C. leucas, and S. mokarran were still classified as highly vulnerable and could be suffering the accumulative effects of decades of fishing pressure. This multidisciplinary approach serves to identify the most vulnerable species throughout the history of the fishery and to understand the vulnerability values within a historical context, avoiding the shifting baseline syndrome.",,,,,"Mendez-Loeza, Ivan/0000-0002-1700-9867; Perez-Jimenez, Juan Carlos/0000-0002-7258-1700",,,,,,,,,,,,0165-7836,1872-6763,,,,JUN,2020,226,,,,,,,,105526,10.1016/j.fishres.2020.105526,,,,,,,WOS:000525305200012,,,,,,
J,"Tolotti, MT; Forget, F; Capello, M; Filmalter, JD; Hutchinson, M; Itano, D; Holland, K; Dagorn, L",,,,"Tolotti, Mariana Travassos; Forget, Fabien; Capello, Manuela; Filmalter, John David; Hutchinson, Melanie; Itano, David; Holland, Kim; Dagorn, Laurent",,,Association dynamics of tuna and purse seine bycatch species with drifting fish aggregating devices (FADs) in the tropical eastern Atlantic Ocean,FISHERIES RESEARCH,,,,,,,,,,,,"Several pelagic fish species are known to regularly associate with floating objects in the open ocean, including commercially valuable species. The tuna purse seine industry takes advantage of this associative behavior and has been increasingly deploying free-drifting man-made floating objects, also known as fish aggregating devices (FADs). Using passive acoustic telemetry, this study describes the associative dynamics of the main targeted tropical tuna species (Thunnus albacores, T. obelus and Katsuwonus pelamis), as well as three major bycatch species, silky shark (Carcharhinus falciformis), rainbow runner (Elagatis bipinmdata) and oceanic triggerfish (Canthidermis maculata). Short-term excursions away from the FADs were frequently performed by all tuna species as well by silky sharks. These excursions were characterized by a marked diel pattern, mainly occurring during nighttime. Rainbow runners and oceanic triggerfish were much more present at the FADs and rarely performed excursions. Average continuous residence times (CRTs) ranged from 6 days, for silky shark, up to 25 days for bigeye tuna. Similar to silky shark, average CRTs for skipjack tuna and oceanic triggerfish were less than 10 days. For yellowfin tuna and rainbow runner, CRTs averaged 19 and 16 days, respectively. Bigeye and yellowfin tuna remained associated to a single drifting FAD for a record of 55 days and 607 km traveled.",,,,,"Filmalter, John/0000-0003-4542-925X",,,,,,,,,,,,0165-7836,1872-6763,,,,JUN,2020,226,,,,,,,,105521,10.1016/j.fishres.2020.105521,,,,,,,WOS:000525305200009,,,,,,
J,"Iki, A; Anderson, WG; Deck, CA; Ogihara, MH; Ikeba, K; Kataoka, H; Hyodo, S",,,,"Iki, Ayuko; Anderson, W. Gary; Deck, Courtney A.; Ogihara, Mari H.; Ikeba, Kiriko; Kataoka, Hiroshi; Hyodo, Susumu",,,"Measurement of 1 alpha hydroxycorticosterone in the Japanese banded houndshark, Triakis scyllium, following exposure to a series of stressors",GENERAL AND COMPARATIVE ENDOCRINOLOGY,,,,,,,,,,,,"An endocrine glucocorticoid response following exposure to a stressor has been well described for many vertebrates. However, despite demonstration of secondary stress responses in a number of elasmobranchs, our understanding of the endocrine control of these responses is lacking. This is largely due to the unusual structure of the dominant corticosteroid in elasmobranch fish, la-hydroxycorticosterone (1 alpha-OH-B). Here we describe plasma extraction and HPLC separation procedures that allowed for the measurement of 1 alpha-OH-B and corticosterone from plasma samples in the cannulated, conscious free-swimming Japanese banded houndshark, Triakis scyllium. While patterns of concentration in the plasma for 1 alpha-OH-B and corticosterone were found to be similar in all experiments conducted, circulating levels of 1 alpha-OH-B were consistently 100-fold greater than circulating levels of corticosterone. Immediately following cannulation surgery, circulating levels of 1 alpha-OH-B increased 7-fold compared to pre-surgery levels, while the levels were 11-fold higher than pre-stress levels 30 min post a repeated handling/air-exposure stress. A three week period of fasting resulted in a 22-fold increase in circulating levels of 1 alpha-OH-B in the banded houndshark. This is the first report of direct measurement of changes in circulating levels of the primary corticosteroid in elasmobranch fish, 1 alpha-OH-B, following exposure to a stressor such as handling/air-exposure. Data indicate the steroid may respond similarly to the classic glucocorticoid response, such as cortisol in teleosts.",,,,,,,,,,,,,,,,,0016-6480,1095-6840,,,,JUN 1,2020,292,,,,,,,,113440,10.1016/j.ygcen.2020.113440,,,,,,,WOS:000525408300008,32067929,,,,,
J,"Krishen, AS; Berezan, O; Agarwal, S; Robison, B",,,,"Krishen, Anjala S.; Berezan, Orie; Agarwal, Shaurya; Robison, Brian",,,"Harnessing the waiting experience: anticipation, expectations and WOM",JOURNAL OF SERVICES MARKETING,,,,,,,,,,,,"Purpose This study aims to explore the anticipated emotions of consumers and their anticipated perceived quality (PQ) of an exhibit, event or service that they are waiting to attend. Design/methodology/approach The study consists of a quantitative survey-based descriptive study of n = 470 real-world consumers from a waiting line at the Shark Reef exhibit in Mandalay Bay Resort and Casino, Las Vegas. Data is analyzed with fuzzy-set qualitative comparative analysis (fsQCA) to extrapolate causal conditions or recipes, for word of mouth (WOM) generation regarding the exhibit. Findings Recipes that influence positive WOM for an upcoming exhibit include: affect evaluation and affect expectations (AEXs) and affect evaluation, affect expectation, event entertainment and PQ. Practical implications By recognizing the need to optimize the customer waiting experience, services marketing managers can more successfully engage customers and influence their subsequent intentions. Originality/value Emotions regarding the anticipation of an upcoming event are critical to cultivating the intent to spread positive WOM.",,,,"AGARWAL, SHAURYA/AAR-4573-2020",,,,,,,,,,,,,0887-6045,,,,,,,,,,,,,,,,10.1108/JSM-10-2019-0382,,MAY 2020,,,,,WOS:000536845600001,,,,,,
J,"Snodgrass, DJG; Orbesen, ES; Walter, JF; Hoolihan, JP; Brown, CA",,,,"Snodgrass, Derke J. G.; Orbesen, Eric S.; Walter, John F., III; Hoolihan, John P.; Brown, Craig A.",,,Potential impacts of oil production platforms and their function as fish aggregating devices on the biology of highly migratory fish species,REVIEWS IN FISH BIOLOGY AND FISHERIES,,,,,,,,,,,,"This review documents the current state of knowledge and gaps therein, as determined through a survey of published research on relevant topics, regarding the potential impacts of offshore oil production platforms (OPP) on the biology of highly migratory fish species (HMS) which include tunas, swordfish, billfishes, and oceanic sharks. There is a limited amount of published research directly related to HMS and OPPs. This may be due to the relatively recent offshore expansion of the industry and of studies. Most studies have focused on structure-associated species such as rockfishes and snappers. Within the U.S. exclusive economic zone, the most probable areas of interaction between HMS and OPPs occur in the Gulf of Mexico. This report focuses primarily upon this region, while noting that HMS roam the majority of the world's oceans and may interact with petroleum infrastructure in many other locations. With such large stock boundaries it is unlikely that HMS interactions with OPPs will have a significant impact at the stock level, however, there could be impacts at local or regional levels.",,,,,"snodgrass, derke/0000-0001-7682-9171",,,,,,,,,,,,0960-3166,1573-5184,,,,SEP,2020,30,3,,,,,405,422,,10.1007/s11160-020-09605-z,,MAY 2020,,,,,WOS:000536453800001,,,,,,
J,"Musa, SM; Ripley, DM; Moritz, T; Shiels, HA",,,,"Musa, Syafiq M.; Ripley, Daniel M.; Moritz, Timo; Shiels, Holly A.",,,"Ocean warming and hypoxia affect embryonic growth,fitness and survival of small-spotted catsharks,Scyliorhinus canicula",JOURNAL OF FISH BIOLOGY,,,,,,,,,,,,"Elasmobranchs are key to a healthy marine ecosystem but are under threat from human activities, such as destructive fisheries and shark finning. Embryos of oviparous elasmobranchs may be further challenged during development by rising temperatures and falling dissolved oxygen concentrations in their intertidal environment. However, the impact of climate change on survival and growth of oviparous elasmobranchs is still poorly understood. Here, we investigate the effects of temperature and hypoxia on the growth and survival of small-spotted catshark (Scyliorhinus canicula) embryos by incubating eggs in normoxia 15 degrees C, normoxia 20 degrees C, hypoxia 15 degrees C, or hypoxia 20 degrees C. Incubation under the elevated temperature increased the embryonic growth rate, yolk consumption rate and Fulton's condition factor at hatching, whilst decreasing the total length and body mass of newly hatched sharks. Under low oxygen conditions (50% air saturation) the survival rate ofS. caniculaembryos dropped significantly and the temperature-induced increase in Fulton's condition factor was reversed. Together, these data demonstrate both the individual and compound effects of elevated temperature and hypoxia on the survival and growth during early ontogeny of a ubiquitous, coastal elasmobranch,S. canicula.",,,,"Musa, Syafiq/AAF-9567-2019","Musa, Syafiq/0000-0001-9170-2646; Ripley, Daniel/0000-0001-5912-6722",,,,,,,,,,,,0022-1112,1095-8649,,,,JUL,2020,97,1,,,,,257,264,,10.1111/jfb.14370,,MAY 2020,,,,,WOS:000539457800001,32383486,,,,,
J,"Bayse, SM; Grant, SM",,,,"Bayse, Shannon M.; Grant, Scott M.",,,Effect of baiting gillnets in the Canadian Greenland halibut fishery,FISHERIES MANAGEMENT AND ECOLOGY,,,,,,,,,,,,"Catch rates were compared between gillnets with and without bait in the Greenland halibut Reinhardtius hippoglossoides (Walbaum) fishery off Baffin Island, Canada. Two different types of baiting techniques were compared: bait bags where squid were placed into 2-mm mesh bags, and tied bait where squid were tied into meshes. Both types of baited gillnets significantly increased the capture of the target species, Greenland halibut, with increases of 253.8% and 149.7% for the bait bag and tied bait, respectively. Common bycatch species showed mixed effects, with roughhead grenadier Macrourus berglax Lacepede showing no increase in catch per unit effort (CPUE) for either bait type (p > 0.05), and porcupine crab Neolithodes grimaldii (Milne-Edwards and Bouvier) only had a higher CPUE with baited gillnets when bait bags were placed on the footrope. Less common bycatch species-but with threatened populations-showed an increase in CPUE, including Greenland shark Somniosus microcephalus (Bloch and Schneider) and Northern wolffish Anarhichas denticulatus Kroyer. Baiting gillnets affected the CPUE of gillnets in the Greenland halibut fishery, and management should consider how the increased CPUE of both target and bycatch species are affected by this new fishery trend.",,,,,,,,,,,,,,,,,0969-997X,1365-2400,,,,OCT,2020,27,5,,,,,523,530,,10.1111/fme.12434,,MAY 2020,,,,,WOS:000537917900001,,,,,,
J,"Pillans, RD; Fry, GC; Steven, ADL; Patterson, T",,,,"Pillans, R. D.; Fry, G. C.; Steven, A. D. L.; Patterson, T.",,,Environmental Influences on Long-term Movement Patterns of a Euryhaline Elasmobranch (Carcharhinus leucas) Within a Subtropical Estuary,ESTUARIES AND COASTS,,,,,,,,,,,,"It is well established that juvenile bull sharks (Carcharhinus leucas) use rivers and estuaries as nursery areas; however, there is a large degree of variation in habitat preference (with respect to salinity and distance upstream) between studies at national and international scales. To investigate habitat preference and the influence of water quality on movement of bull sharks, we monitored 36 juveniles using an array of acoustic receivers in the Logan and Albert Rivers, Australia, for 30 months. Acoustic data were used to estimate mean daily distance upstream, and generalized additive models were used to determine the influence of flow, salinity, temperature, dissolved oxygen, turbidity, and chlorophyllaon movement. A model that included flow, salinity, dissolved oxygen, and chlorophyllaexplained 89% of the variance. Movement was tightly correlated to both flow and salinity with sharks moving downstream in response to increasing flow/declining salinity and upstream during low flow/increasing salinity. During periods of negligible flow and stable salinity, animals moved upstream and downstream in response to decreasing and increasing dissolved oxygen, respectively. Dissolved oxygen and temperature were strongly negatively correlated and interchangeable within the model. Despite fluctuations in environmental salinity (0-32 psu) and a strong declining gradient in salinity with increasing distance upstream, bull sharks remained within a narrow band of salinity (6-10 psu) throughout the tracking period. The results of this study indicate that habitat choice by juvenile bull sharks is a complex tradeoff between physiology, food availability, and predator avoidance, resulting in large differences between adjacent systems and more broadly across their range.",,,,,"Pillans, Richard/0000-0001-6234-8764; Patterson, Toby/0000-0002-7150-9205",,,,,,,,,,,,1559-2723,1559-2731,,,,,,,,,,,,,,,10.1007/s12237-020-00755-8,,MAY 2020,,,,,WOS:000556454600001,,,,,,
J,"Niella, Y; Smoothey, AF; Peddemors, V; Harcourt, R",,,,"Niella, Yuri; Smoothey, Amy F.; Peddemors, Victor; Harcourt, Robert",,,Predicting changes in distribution of a large coastal shark in the face of the strengthening East Australian Current,MARINE ECOLOGY PROGRESS SERIES,,,,,,,,,,,,"In the face of accelerating climate change, conservation strategies will need to consider how marine animals deal with forecast environmental change as well as ongoing threats. We used 10 yr (2009-2018) of data from commercial fisheries and a bather protection program along the coast of New South Wales (NSW), southeastern Australia, to investigate (1) spatial and temporal patterns of occurrence in bull sharks and (2) environmental factors affecting bull shark occurrence along the coast of NSW. Predicted future distribution for this species was modelled for the forecast strengthening East Australian Current. Bull sharks were mostly harvested in small to larger estuaries, with average depth and rainfall responsible for contrasting patterns for each of the fisheries. There was an increase in the occurrence of bull sharks over the last decade, particularly among coastal setline fisheries, associated with seasonal availability of thermal gradients >22 degrees C and both westward and southward coastal currents stronger than 0.15 and 0.60 m s(-1), respectively, during the austral summer. Our model predicts a 3 mo increase in the availability of favourable water temperatures along the entire coast of NSW for bull sharks by 2030. This coast-line provides a uniquely favourable topography for range expansion in the face of a southerly shift of warmer waters, and habitat is unlikely to be a limiting factor for bull sharks in the future. Such a southerly shift in distribution has implications for the management of bull sharks both in commercial fisheries and for mitigation of shark-human interactions.",,,,,"Niella, Yuri/0000-0003-1878-6091; Harcourt, Robert/0000-0003-4666-2934",,,,,,,,,,,,0171-8630,1616-1599,,,,MAY 28,2020,642,,,,,,163,177,,10.3354/meps13322,,,,,,,WOS:000545930000011,,,,,,
J,"Kumar, NS; Suvarna, RP; Naidu, KCB; Banerjee, P; Ratnamala, A; Manjunatha, H",,,,"Kumar, N. Suresh; Suvarna, R. Padma; Naidu, K. Chandra Babu; Banerjee, Prasun; Ratnamala, A.; Manjunatha, H.",,,A review on biological and biomimetic materials and their applications,APPLIED PHYSICS A-MATERIALS SCIENCE & PROCESSING,,,,,,,,,,,,"In the development of technology, a source of inspiration for mankind is the nature. Naturally, many biological surfaces having unique micro-nanostructures, such as lotus leaves, butterfly wings, rose petals and shark skin, exhibit skills and attribute beyond conventional engineering. These skills and characteristic properties are exploited by several scientists to produce bioinspired materials by mimicking biological materials. Scientists called these materials as biomimetic materials as they are developed by inspiration from nature. For the last few decades, an extensive research has been going on to introduce a wide variety of biomimetic materials which can exhibit advanced properties. This paper gives an overview of recently developed biomimetic materials such as Se-modified carbon nitride nanosheets, small intestinal submucosa, magnesium-strontium hydroxyapatite, dimethylglyoxime-urethane polyurethane, polydimethylsiloxane, Ag/Ag@AgCl/ZnO and PDTC(COOH)(4)/HA, along with their biological properties. In addition, the applications of the biomimetic and biological materials in various fields such as biomedical, oil-water separation, sensors, tissue engineering, genome technology and ultrasound imaging are also discussed.",,,,"Banerjee, Prasun/N-2506-2013; Naidu, K Chandra Babu/AAQ-5691-2020","Banerjee, Prasun/0000-0001-8473-6610; Naidu, K Chandra Babu/0000-0002-0580-6383",,,,,,,,,,,,0947-8396,1432-0630,,,,MAY 25,2020,126,6,,,,,,,,10.1007/s00339-020-03633-z,,,,,,,WOS:000537846100001,,,,,,
J,"Villafana, JA; Hernandez, S; Alvarado, A; Shimada, K; Pimiento, C; Rivadeneira, MM; Kriwet, J",,,,"Villafana, Jaime A.; Hernandez, Sebastian; Alvarado, Alonso; Shimada, Kenshu; Pimiento, Catalina; Rivadeneira, Marcelo M.; Kriwet, Juergen",,,First evidence of a palaeo-nursery area of the great white shark,SCIENTIFIC REPORTS,,,,,,,,,,,,"Shark nurseries are essential habitats for shark survival. Notwithstanding the rich fossil record of the modern great white shark (Carcharodon carcharias, GWS), its use of nursery areas in the fossil record has never been assessed before. Here, we analysed the fossil record of the GWS from three South American Pliocene localities, assessed body size distributions and applied previously established criteria to identify palaeo-nurseries. We found that juveniles dominate the Coquimbo locality (Chile), whereas subadults and adults characterize Pisco (Peru) and Caldera (Chile), respectively. These results, summed to the paleontological and paleoenvironmental record of the region, suggest that Coquimbo represents the first nursery area for the GWS in the fossil record. Our findings demonstrate that one of the top predators in today's oceans has used nursery areas for millions of years, highlighting their importance as essential habitats for shark survival in deep time.",,,,,,,,,,,,,,,,,2045-2322,,,,,MAY 22,2020,10,1,,,,,,,,10.1038/s41598-020-65101-1,,,,,,,WOS:000540510300005,32444686,,,,,
